Datetime,URL,Tweet,Username
2023-06-15 16:18:45+00:00,https://twitter.com/HanzaBananza47/status/1669378922566283265,"@suchnerve Every kid that is placed into the ""gifted"" group at their school by teachers should 100% be tested for autism/adhd as well as anxiety/depression. I didn't get diagnosed until I was 21 and thought Teen Me was pathetic because I couldn't keep up with the smart kids anymore.",HanzaBananza47
2023-06-15 16:16:25+00:00,https://twitter.com/lovelysouldemon/status/1669378335330168834,"@BlaxkGem I am also diagnosed with adhd, but not autism even though you could see some of it when I was young, but you know...afab. These antis need to stop being so ableist and privileged about who is and isn't autistic. Dream more than likely is autistic.",lovelysouldemon
2023-06-15 16:08:19+00:00,https://twitter.com/Miles_Fuxk/status/1669376296789352449,I self diagnosed myself with autism at age 13 (just after being diagnosed with ADHD) and had to wait THREE years before i was officially diagnosed because my parents couldn't afford to pay for a private clinic. there are SO many reasons as to why someone will self diagnose.,Miles_Fuxk
2023-06-15 16:07:35+00:00,https://twitter.com/emilykmay/status/1669376112097361922,@dreya_hope Lol I was diagnosed with adhd at 12 and yes to the constant accusations of flirting 🙃🙃🙃🙃,emilykmay
2023-06-15 15:38:37+00:00,https://twitter.com/karlscupid/status/1669368823848501248,@lRONITES Exactly like i was diagnosed with adhd at 9 yrs old but wasnt diagnosed w autism until my senior year of highschool. Like why do ppl think diagnoses is a one and done easy process ???,karlscupid
2023-06-15 15:29:39+00:00,https://twitter.com/ShadeauxCat/status/1669366568151646208,"@shahh Getting correctly diagnosed with ADHD after 30+ years. Before that, ketamine infusions were the only thing that helped with my depression. I was part of clinical trials and under supervision of a doctor while undergoing treatment. Cannabis helps too.",ShadeauxCat
2023-06-15 14:44:57+00:00,https://twitter.com/hausofsquirrel/status/1669355317170409472,I probably won’t get the help. I’m Autistic and have ADHD (private diagnosis last year). I was told by the consultant psychiatrist who diagnosed me that I need treatment for my ADHD but the company I went with was solely a diagnostic service.,hausofsquirrel
2023-06-15 13:37:29+00:00,https://twitter.com/CameronWaddel/status/1669338338074181632,"@WillingBlam I have recently started following Crit Role and am currently watching C1:E29. I was diagnosed with ADHD, at age 47, last year. I noticed you biting your nails just after you got in and googled the obvious. So glad to share something with you. Love to Laura also.🙂❤",CameronWaddel
2023-06-15 12:36:53+00:00,https://twitter.com/loreestark/status/1669323089094557697,"@phiamiriam I didn't get diagnosed with ADHD until I was 38. I was never the top of my class in high school or college or law school but I was a high achiever in extracurriculars (band, newspaper, law journal, internships). Looking back it's bananas it took so long to get that diagnosis",loreestark
2023-06-15 12:28:38+00:00,https://twitter.com/blairhoover/status/1669321013853552643,"I didn't need accomodations in the past because I was able to give them to myself. Once I became a parent, I no longer had the ability to give myself the time I needed.

I have learned that it is very common for women to be diagnosed with ADHD after they have children.",blairhoover
2023-06-15 11:56:47+00:00,https://twitter.com/OhWitchy/status/1669312997091581953,"@monkeyspaw @NomeDaBarbarian Oh, I've been diagnosed with adhd since I was a kid, it's the Autistic bit I'm wondering about. I didn't make that terrible clear, my apologies.",OhWitchy
2023-06-15 10:49:29+00:00,https://twitter.com/doublenegativeL/status/1669296058453598208,"@makersnfounders @CHADD_ADHD I was diagnosed with depression &amp; anxiety at first, not knowing (until 2 years later) that women are sometimes diagnosed with one of these conditions before underlying ADHD is pinpointed. Really revealing for me, as last 5 years I've been unwell &amp; bewildered by symptoms.",doublenegativeL
2023-06-15 09:30:12+00:00,https://twitter.com/chrisfilmandart/status/1669276107508441088,"@LMBD1418 I have always refused to go down the path of medication, ever since I was diagnosed as a child.
There are times I struggle quite a bit, even with my mild ADHD, but *personally* I’d rather live with that than risk meds restricting my creativity and sociability.",chrisfilmandart
2023-06-15 08:55:30+00:00,https://twitter.com/GSableye/status/1669267374317420546,"@April0895901344 @FayeBlackwellVT I have most of these but the category with the most I don't relate to would be autism, though I was diagnosed at 7 as aspergers. Last time I saw a psychiatrist I scored high on adhd test and they said I likely have it but they don't want to give labels as I already have autism",GSableye
2023-06-15 08:52:14+00:00,https://twitter.com/pokedrms/status/1669266554901471232,@Lindsay89227450 this actually isn’t true at all when i was diagnosed with adhd i was 7 years old and they didn’t pick on my my autism until i was 18 because i was masking it so well without even knowing it’s not easy to find in everyone,pokedrms
2023-06-15 08:26:58+00:00,https://twitter.com/egn0gg/status/1669260193916661762,@lynksies @dreamprettyboy i am like almost completely sure i’m autistic and will not be getting diagnosed bc 1. i can’t afford it and 2. i’m trans. also i was diagnosed with adhd at 19 which isn’t the same thing but like;;; still went all the way though school without anyone realizing i was,egn0gg
2023-06-15 08:24:12+00:00,https://twitter.com/k_ayfilms/status/1669259498911875077,"@bambignf my school wanted me to be tested for adhd when i was a kid. my mom just took me to the eye doctor because i also could not see. they figured that solved all my “issues” but now i’m 21. 6 months ago, i was diagnosed with adhd 😀",k_ayfilms
2023-06-15 07:07:30+00:00,https://twitter.com/thesimsrepproj/status/1669240194560655362,"@sweettaterfries I was officially diagnosed autistic/ADHD about two years ago now &amp; I’ve been learning to “unmask” since then

These last few days have made me want to mask or refrain from socializing all together bc I’m too worried if wat I say will be misinterpreted again

I agree with you 😔💔",thesimsrepproj
2023-06-15 06:18:14+00:00,https://twitter.com/CocoChocolatePu/status/1669227796177244160,"@Mapleepaw When I was diagnosed in my late teens with ADHD another part of the diagnosis, was that the doctor said I show ""Signs of autism"", I legit got a maybe when I got tested
The fact people are gatekeeping autism of all things is crazy &amp; idk if they know the harm their words can bring",CocoChocolatePu
2023-06-15 06:00:27+00:00,https://twitter.com/carebearkarl/status/1669223321911566337,"@lynksies I was diagnosed with ADHD at age 8 and I struggle to this day(I don’t take meds as I’ve been through so much trial and error), but I’m also on the spectrum I’ve been asked by friends and teachers if I had it but I’ve been denied a diagnosis since I moved to a conservative state",carebearkarl
2023-06-15 05:54:38+00:00,https://twitter.com/lynksies/status/1669221859814981632,"@carebearkarl Yep. When I was little, nobody looked into me for ADHD either because I was a little girl. Didn't know I had it until I was 19 and I was diagnosed with Autism this year (25)",lynksies
2023-06-15 05:08:12+00:00,https://twitter.com/twit_ash/status/1669210171896385536,"Undiagnosed #ADHD meant I failed 7th form at high school.

Diagnosed at 30, I was told I would do very well at uni. I scoffed, thinking I wasn’t smart enough.

I gave it a shot and graduated with a BA. Then 1st class honours.

That smile reflects genuine pride. 

Next up - PhD! https://t.co/bGOo7IER5l",twit_ash
2023-06-15 04:10:58+00:00,https://twitter.com/Unixsystem13/status/1669195769826377728,"@AdamSinger I was diagnosed with ADHD ages ago, but I have no idea if I actually have it - or if it's even a real condition.

For anyone that's been stuck on it for years, just try committing to going without it for a few months. You might be shocked at how easy it is to quit.",Unixsystem13
2023-06-15 03:50:34+00:00,https://twitter.com/RemiTheRender/status/1669190636359102465,"AHHHHHH i just dumped out all my anxiety on a moot that was just asking how i was. why am i like this 😭 i need to be more consistent in keeping up with conversations, i need my dang adhd diagnosed so i can actually use my brain 😭😭😭",RemiTheRender
2023-06-15 03:49:50+00:00,https://twitter.com/leahridder386/status/1669190451335942145,@honeydrms I was diagnosed with ADHD when I was a newborn 😪/j,leahridder386
2023-06-15 03:40:46+00:00,https://twitter.com/terranoia_/status/1669188170414706688,"@BlaxkGem like I was smart as fuck but I was also struggling later on and getting F's 😭 I'm lucky I was diagnosed already because I had a chance meltdown. and in a reverse twist, I got diagnosed with ADHD very recently and it wasn't detected when I was younger",terranoia_
2023-06-15 03:34:42+00:00,https://twitter.com/DeviTheDeviant/status/1669186643511885824,Where she admitted that when my brother and I were diagnosed with adhd we were also diagnosed to be on the high functioning side of the autism spectrum. Most people aren’t as lucky as me (but I wasn’t really lucky because I was only diagnosed during tests for trauma),DeviTheDeviant
2023-06-15 03:20:54+00:00,https://twitter.com/harrydrew2022/status/1669183169109856259,@Benjamincraig01 @KEEMSTAR @dreamwastaken adhd is considered a part of autism. due to how simular they are. *i was diagnosed with asd with my adhd.,harrydrew2022
2023-06-15 03:20:01+00:00,https://twitter.com/Ana_diilua/status/1669182946849308673,This is stupid as fuck. I was diagnosed at 23yo when I was struggling with college. You don't have to be a baby or a kid to get diagnosed. And Dream also has ADHD so he might have talked to his therapist to come to that conclusion. https://t.co/DuHaggnoOS,Ana_diilua
2023-06-15 03:18:38+00:00,https://twitter.com/AmVibingRose/status/1669182601616056320,"@lynksies Indeed, I was diagnosed with adhd and autism when I was a child, but I don’t try to gatekeep either. Would be lovely if people would stop acting like being neurodivergent is a fun little quirk.",AmVibingRose
2023-06-15 03:18:38+00:00,https://twitter.com/lynksies/status/1669182601217691648,@saelesc This!!! Also with ADHD cause I was diagnosed when I was 19 because nobody fucking checked when I was little because I was a little girl and little girls are just ditzy.,lynksies
2023-06-15 01:47:17+00:00,https://twitter.com/ChaosKittyEm/status/1669159613349134336,"When I was first diagnosed with ADHD, I had people try to tell me that it was because of ""childhood trauma"" and not because I have neurodevelopmental disorder.

Anyway, Dr Russell Barkley is the GOAT and you should watch this:

https://t.co/20fA07qZgi",ChaosKittyEm
2023-06-15 01:44:40+00:00,https://twitter.com/dizalifornia/status/1669158951697645570,@AdamSinger I wasn't diagnosed until I was 29. All of my teens and 20s I grappled with feeling a failure bc I had tons of potential yet 'failure to launch'. I always wonder if my trajectory had been different if my parents caught my ADHD early in life. Early successes mean a lot.,dizalifornia
2023-06-15 01:42:56+00:00,https://twitter.com/BeaAteTheBees/status/1669158517293424640,"@CollectedDeers @hebrideanlamb @HikeMix @ForWomenScot @JordanPfot i think the funniest part about her getting mad at me for saying that is ive been diagnosed with autism and adhd since i was like 11

anyway sheila i do genuinely try to be as kind as i can to people, as long as those people don't try to push false naritives made to stop certain",BeaAteTheBees
2023-06-15 01:33:00+00:00,https://twitter.com/_Jojo_Bee_/status/1669156017052213248,"I was recently diagnosed with ADHD and too be honest, it explains SO much about myself.",_Jojo_Bee_
2023-06-15 01:27:40+00:00,https://twitter.com/KaaayyKirkland/status/1669154675504078850,i was recently diagnosed with adhd  and when i say things make so much more sense now….,KaaayyKirkland
2023-06-14 23:22:05+00:00,https://twitter.com/StepHanie_CK20/status/1669123070693625856,"A few months ago, I was diagnosed with ADHD, Autism and Clinical depression. 

It was an ""aha"" moment for me. The reason I feel different. The reason I didn't seem to understand people growing up, the reason I had to put in 3x as much effort as anyone else to get something done.",StepHanie_CK20
2023-06-14 22:51:47+00:00,https://twitter.com/lws3813/status/1669115444954034176,@the_tweedy My brother was diagnosed with ADHD as a child. My daughter was a senior in highschool and I was 50 when we were both diagnosed with ADHD. Girls are very different than boys in how it presents and we often have developed cheats that help us function. Lists. Legendary for lists.,lws3813
2023-06-14 22:28:01+00:00,https://twitter.com/RewHens/status/1669109465608495104,@wutanimations Lol when you said this I instantly started hearing a Miku song remix in my head. I was diagnosed with ADHD when I was 12.,RewHens
2023-06-14 21:37:30+00:00,https://twitter.com/pipinthepenguin/status/1669096750408163330,"@flareaudio Agreed! I have ADHD but bought these before I was diagnosed.... brilliant for those harsh sounds. I found a housemate's laugh so jarring I wanted to leave the house, with these in no problem 😊",pipinthepenguin
2023-06-14 19:04:13+00:00,https://twitter.com/YourLocalKong/status/1669058175889186824,"@dreamwastaken I have ADHD, and taking meds made me worse. I was diagnosed young, with several other disabilities, physical and mental, so I got over it quickly, with only a few traits left.
I can tell you ain't one of us if you groom minors. 0 sympathy.",YourLocalKong
2023-06-14 18:56:08+00:00,https://twitter.com/MikeLit46544834/status/1669056142306058250,"@Andtism I wish it wasn't real. I was diagnosed at around 7. Took Ritalin for a little while, caused gynecomastia so I stopped. As an adult ADHD  has hindered my ability to make friends and keep them. Lol once a loner always a loner. I am cool with it now. Just who I am. No meds though.",MikeLit46544834
2023-06-14 17:49:15+00:00,https://twitter.com/arkidie/status/1669039310304075782,"@autistic_dutske I also haven’t been diagnosed with adhd, but my mom, brother, and aunt have. And when I was 6 my kindergarten teacher told my mom she thinks I have adhd, and so my mom asked my pediatrician who said I wasn’t and my mom didn’t look further into it 🥲",arkidie
2023-06-14 17:35:23+00:00,https://twitter.com/Jayke047/status/1669035821297729537,"@stats_feed In India, mental health diagnosis is pretty much non existent. My own relatives asked my parents if I'm ""crazy"" since I was diagnosed with ADHD.",Jayke047
2023-06-14 16:11:19+00:00,https://twitter.com/TheChoccyKing/status/1669014663214817280,"ALSO i think my my brain diagnosis stuff has been broadened

if i read things right, im now diagnosed with:

combined type adhd
ocd
gad
and tics (he said i might have tourettes? im not sure, i was having a tad of a hard time understanding)",TheChoccyKing
2023-06-14 16:03:17+00:00,https://twitter.com/charscomet13/status/1669012644492091393,before i was diagnosed with adhd i went through a phase of writing the initials of all the lyrics to songs in my school books then guessing which song it was next lesson lol,charscomet13
2023-06-14 15:09:48+00:00,https://twitter.com/Rawrgen/status/1668999181787119617,"//sorry for no activity i was busy getting diagnosed with ADHD, you know how it is",Rawrgen
2023-06-14 14:38:29+00:00,https://twitter.com/MegGilliland/status/1668991302455664642,@AutisticCoach_ 100%. I was misdiagnosed with type II in college and correctly diagnosed with ASD/ADHD in my early thirties. Wild ride.,MegGilliland
2023-06-14 14:33:56+00:00,https://twitter.com/balefulbasal/status/1668990157461094400,"Yeah I was diagnosed with only OCD and depression at 15yrsold because the psychologist who “tested” me said “We dont need to check for autism or adhd because you can make eye contact, you like loud music, and you are intelligent.” And I just took his word for it 😔",balefulbasal
2023-06-14 13:44:07+00:00,https://twitter.com/weirdbeingg/status/1668977622502522880,@tellemtell @Lucid_birdbrain I was diagnosed with adhd when I was still in kindergarden because I wouldn't shut tf up and moves around like a fish on dry land,weirdbeingg
2023-06-14 13:00:19+00:00,https://twitter.com/notfoundream/status/1668966599494365184,"since we're on topic, thought i'll share but i got diagnosed with ADHD when i was an adult, i was 23, and one of the things that i realized is that, while it makes me feel relieved because things started to make sense as like why did i do that or why did i do this, it's also feel like a slap in the face because i can't remember most of my childhood, i can only remember bits of it, and idk if anyone else struggle with it as well but ive always thought that there's something wrong with me or what because i can't remember things, but when i got my diagnosis, it's all somehow makes sense, im still learning a lot about ADHD and taking my medication",notfoundream
2023-06-14 10:53:26+00:00,https://twitter.com/SufferingMental/status/1668934668165455872,@rcpsych As a child if i had been born in this day &amp; age i would have been likely diagnosed with ADHD. However i am glad i was not as i would have been medicated &amp; i believe that would have been harmful. I have dyslexia &amp; Elhers Danelos with a scoliosis but this was not diagnosed until,SufferingMental
2023-06-14 10:36:06+00:00,https://twitter.com/SalemGalaxia/status/1668930305921523714,"Give me educated feedback and engage in discussions!
Also, i have ADHD myself. While i can't speak for everyone with ADHD because neurodiversities are a spectrum, i do know what it means to have ADHD fairly well. I was diagnosed in my 20ies, which is considered a late diagnosis~",SalemGalaxia
2023-06-14 09:44:49+00:00,https://twitter.com/leonardeo60/status/1668917399247106049,"@ph0ssy_jaw @KatieHorneshaw Same for me. I tried to get a stupid Physiatrist to understand I was diagnosed with ADHD at the age of nine to no avail.  They always play it safe.  Since the FDA put a black box around Xanex, they really think that is a law, rather than caution. Never plea to any Physiatrist",leonardeo60
2023-06-14 08:55:21+00:00,https://twitter.com/agnefriid/status/1668904951052136448,pls wish me luck y'all i have an appt. with a new psychiatrist to hopefully get me on adhd meds (ive been diagnosed for a year now but never been treated for it). my last psychiatrist didn't believe i was actually autistic or adhd so im rly scared that it will happen again,agnefriid
2023-06-14 04:15:49+00:00,https://twitter.com/alwaysadri1/status/1668834605171089408,Me thinking i was going to see a psychiatrist for adhd but ends up getting diagnosed with a personality disorder https://t.co/ueghAch6EX,alwaysadri1
2023-06-14 02:18:16+00:00,https://twitter.com/renegade_roo/status/1668805019058196480,"@DiegoSheppy My life changed as soon as I was mediated for ADHD. My grades jumped my last year in high school! 

Also I hear ya. I was diagnosed with bipolar around the age of 27. Mental health sometimes creep up on you... but I've learned that none of us are alone in our journey",renegade_roo
2023-06-14 01:46:54+00:00,https://twitter.com/angrybooklady/status/1668797128896835585,"@KittenBalerion I haven't gotten ADHD diagnosed yet, but I had the same thing happen with Wellbutrin. Got on it for depression and realized I was focusing much better on it.",angrybooklady
2023-06-14 01:22:37+00:00,https://twitter.com/sapphireultra/status/1668791015296081922,"@isleofgnf no seriously, i was recently diagnosed with adhd and him talking about his has helped me feel so much better about everything. all these things i thought only i did, i saw him do and it just made me so much more comfortable",sapphireultra
2023-06-14 00:31:23+00:00,https://twitter.com/renegade_roo/status/1668778122769240065,"Also yes, I've been diagnosed with ADHD since I was 17 (took that long for my parents to actually take me somewhere to figure out what was wrong). I just need to learn better life skills to manage it better I guess. It just makes me unbelievably angry at myself",renegade_roo
2023-06-14 00:27:32+00:00,https://twitter.com/renegade_roo/status/1668777155810193408,"@ShamanUlfromr Oh I've been diagnosed with ADHD since I was 17 my friend... I know it's part of it, but I just want to push myself to do better. I want to learn how to focus better and finally accomplish something",renegade_roo
2023-06-13 23:52:11+00:00,https://twitter.com/omgtannies/status/1668768258608996353,i think one of the weirdest moments i've had in my life is when i was diagnosed with adhd and got recommended adderall only to find out after 3 days of being on it that i am serverly allergic to it.,omgtannies
2023-06-13 23:23:18+00:00,https://twitter.com/scrivs/status/1668760988806692865,"Today, I got officially diagnosed with ADHD.

I'm 42. 

That means for 20+ years of building online businesses  I've been playing with a hidden set of rules that I was unaware about.

We all are... https://t.co/sxun6OW7Lr",scrivs
2023-06-13 22:28:08+00:00,https://twitter.com/schutzsmith/status/1668747107446996995,"I was diagnosed 25 years ago and have been treating it with straterra and constantly evolving my routine for about 20 years.

It’s in my bio to let people know they can achieve shit and be ADHD.

In the past 3 years, TikTok has taught me more about better ways to manage my ADHD than the dozen or so books and multiple doctors I saw over the years.

So yeah, I am proud to make ADHD part of who I am because it is always on. I cannot turn it off. I can only manage it. 

As a developer, teacher, speaker, organizer, manager, etc. my ADHD superpowers of hyperfocusing and extreme attention to detail have absolutely helped me excel.

I have met so many people at conferences and online that after they find out I’m ADHD, share how they’ve struggled and “are probably ADHD” but never bothered to get diagnosed.

The one year I decided not to follow my regiment or medication, I lost my house, my job, and almost my wife. We call it the “blip” year lol.

Before TikTok I can say that when I told people I was ADHD there was a lot of shame. Not many people understood what it was, and I know that some people felt I was “damaged goods” in a way. 

As I got older I didn’t give a crap anymore what people thought. So that’s why I have #ADHD in my profile and talk about it on social media time to time. Because I know there’s other people out there who feel now like I used to and don’t think there is any possible better way of living.

I’d suggest you get checked out if you truly think you have it. A combination of routine, medication, and therapy can be an amazing change for the better.

Happy to suggest some people to follow for more info, support, and tips.",schutzsmith
2023-06-13 22:23:23+00:00,https://twitter.com/DrAimeeGrant/status/1668745910304616452,"@spacedoutsmiles I love working with @JulieOsbornPsy - when I was in a significant burn out &amp; couldn't read, Julie helped me get back to my (academic) work and writing.

I'm not diagnosed with ADHD, but definitely have ADHD traits &amp; have Autism and Dyslexia diagnoses. Julie is an ADHD specialist",DrAimeeGrant
2023-06-13 21:09:50+00:00,https://twitter.com/MissFuryOrg/status/1668727400874532868,@Shpigford I was diagnosed with ADHD as an adult in 2013. It continues to be one of the best days of my life,MissFuryOrg
2023-06-13 20:23:11+00:00,https://twitter.com/squirrel_bd/status/1668715661055660033,"@JewishWonk I was diagnosed with industrial strength ADHD in my 30s and those are things I absolutely do every day.
If I'm going to cook something I will dig out a few ingredients, put them on the counter, find the pans, set them out, get ingredients stored elsewhere...all over several hours",squirrel_bd
2023-06-13 20:07:05+00:00,https://twitter.com/attentionfixed/status/1668711607780663299,"In 5th grade I was a straight A student and loved school.

In 6th grade I was called a ""bad kid"", diagnosed with ADHD, and drugged.

I was the same kid. The teachers were different.

This is a lesson for parents.",attentionfixed
2023-06-13 18:15:00+00:00,https://twitter.com/harlanrosen/status/1668683402667499533,"when I was formally diagnosed last year with adhd (and the rest of the country, apparently), I asked my doctor if I can start calling myself “neurodiverse”

Doctor told me, “Harlan there is no prescription you can take to cure you of being a jerk on the internet.”

A fair point",harlanrosen
2023-06-13 18:14:52+00:00,https://twitter.com/Heel_MattQ/status/1668683368874012672,@Mollys_ADHD I’m recently diagnosed with ASD and ADHD. I knew I was autistic but had no idea about ADHD prior to diagnosis. I’ve been trying to find safe spaces to talk to people on twitter but all you find is people saying their opinion is the only one that matters and when you say your,Heel_MattQ
2023-06-13 16:27:38+00:00,https://twitter.com/TheChaoticArt/status/1668656383493910538,"So I was diagnosed with ADHD a week ago and since then I had a clearer mind. From my childhood, it started to make sense to me. While I wish this could’ve happened way sooner, I’m glad that I’m getting the help I actually need. So stay tuned for more art and animation💫",TheChaoticArt
