Datetime,URL,Tweet,Username
2023-06-11 03:08:36+00:00,https://twitter.com/Hideydawg/status/1667730525744779264,It wasn’t until recently while working with a tutor and therapist that I was diagnosed with #ADHD. My problem with #sequencing is why subjects like math and music theory were so hard for me. Sometimes I work a problem backwards,Hideydawg
2023-06-11 02:40:29+00:00,https://twitter.com/saffronsonata/status/1667723448502702084,"@Saeko_Cut I was diagnosed with ODD when I was FIVE. Five years old. I actually had ADHD and issues with sleep deprivation, and parents that spanked me instead of figuring out what’s going on. ODD is just a way fr lazy people to blame anything other than their bad parenting for misbehavior",saffronsonata
2023-06-11 02:32:59+00:00,https://twitter.com/Paranyan03/status/1667721560667435011,"It’s weird, when I compare myself to when I was first diagnosed with ADHD to others, I realize my family had no idea how to deal with me. The only thing they knew was the meds to take. They didn’t look up how to help me or anything.",Paranyan03
2023-06-11 01:56:04+00:00,https://twitter.com/Angelsrage3/status/1667712270799912964,"@SlimeTheGoober @Saeko_Cut Agreed. Like people don’t know what they are talking about lol. I have legit documents from when I was diagnosed (with adhd, and ODD) from YEARS AND YEARS ago. And there’s so many.",Angelsrage3
2023-06-11 01:39:38+00:00,https://twitter.com/maronanunyattv/status/1667708135828606978,I've been diagnosed with ADHD since I was in gr 2. I've had family members look me in the face and tell me it's fake. When I pushed back I  was met with backpedaling and falsehoods. It ended with a family member once leaving in a huff and avoiding the topic since.,maronanunyattv
2023-06-11 00:45:58+00:00,https://twitter.com/pluviophiliced/status/1667694628622008321,sometimes i think about when i was diagnosed with adhd as a grown ass adult and i had a breakdown bc i thought i was just a bitch who thought all people were boring and that had to be the reason i zone out and don’t retain anything people say to me,pluviophiliced
2023-06-11 00:08:08+00:00,https://twitter.com/floatingant/status/1667685109968048128,"@fochti @wawanaqueer Absolutely, I was diagnosed with anxiety when I was maybe 8 and only a year ago did i get diagnosed with autism, and earlier this year got diagnosed with ADHD
I suspected I had both for most of my life - sometimes professionals dismiss the possibilites and its frustrating",floatingant
2023-06-10 23:58:40+00:00,https://twitter.com/Diogenes3000/status/1667682726424584192,"One could read this on my sub stack post,  but I was falsely accused on abuse by an over-zealous social worker who did zero due diligence before calling DCFS as a result of an irrational and emotional claim made by my 9 yr old child who had just been diagnosed with ADHD.",Diogenes3000
2023-06-10 23:42:17+00:00,https://twitter.com/Insomniac__at/status/1667678604359073793,@LivvieHarts my eyesight in my left eye is -4 and I was never diagnosed with autism or adhd until I was 20,Insomniac__at
2023-06-10 22:18:49+00:00,https://twitter.com/fakestrawbs/status/1667657599292981251,"@Owen_Trett I was diagnosed with ADHD in November through psychiatry UK! first GP appointment in July last year for referral, diagnosed in November, start my third week of meds next week! DMs are open if you would like more info!",fakestrawbs
2023-06-10 22:09:24+00:00,https://twitter.com/madiclark47/status/1667655227342835741,Firstly I have 3 other siblings with autism and after getting diagnosed with adhd I still felt like something was missing and then it hit me 💀 I was sad about it but everything makes sense now I just wish I knew sooner- it would’ve saved so much heartache and confusion 🥲,madiclark47
2023-06-10 20:53:54+00:00,https://twitter.com/Gethai5/status/1667636228651450369,I said this before I'll say it again I had severe depression and adhd ever since I was like 6 and I started getting schizophrenia symptoms in late 2014 and was diagnosed with depression in 2018 and diagnosed with schizophrenia in 2020 but currently I am only on anti-psychotics.,Gethai5
2023-06-10 20:15:46+00:00,https://twitter.com/CPL_Records/status/1667626630880133121,"@Saeko_Cut I was diagnosed with this when I was 9, along with ADHD and autism. Plus me having shitty parents I tried to stand up against at the time.",CPL_Records
2023-06-10 19:54:06+00:00,https://twitter.com/KITTY_MANYA/status/1667621179224387586,"@autisticcraigg yeah lol I got diagnosed with ADHD and social anxiety and for awhile I was like ""ok that makes sense"" but once I was closer to being out of school I was more idk... I don't feel unreasonably anxious about social interactions except in very specific scenarios.",KITTY_MANYA
2023-06-10 19:16:40+00:00,https://twitter.com/forevergoogie/status/1667611756737310720,@fochti my pediatric psychiatrist was great. he actually studied autism specifically and diagnosed me with adhd and then a year or so later (i was 7/8) bipolar. said i had some autistic tendencies too. he was one of the good ones. he cared about more than just how my meds were working,forevergoogie
2023-06-10 19:03:25+00:00,https://twitter.com/420fairycore/status/1667608421892341761,@Saeko_Cut and its considered under the umbrella of autism yet my family would never believe i would have autism or adhd even tho my brother was diagnosed with both and i was with adhd as well,420fairycore
2023-06-10 18:20:40+00:00,https://twitter.com/SarahMenace213/status/1667597666799484929,"@therapiworks Tbh I think having a therapist who doesn’t have their own shit together can actually be considered as a trigger &amp; worsen the trauma or issues we’re dealing with. For instance I have adhd, been diagnosed since I was 15 in the middle of the 90’s and therapists are still clueless. https://t.co/6hKVgO7lO2",SarahMenace213
2023-06-10 18:17:45+00:00,https://twitter.com/nightngalelight/status/1667596932490104832,"@fochti It was harder for me to be diagnosed with ADHD because since I was the subcategory of ADD I’m not hyperactive which leads me to instead of disrupting the class I go and daydream all the time and can’t focus at all, making it harder for ppl to tell when I stop paying attention",nightngalelight
2023-06-10 17:28:24+00:00,https://twitter.com/KelCesarVQ/status/1667584511406665731,@fochti I was diagnosed by my psychologist with ADHD and because of my suspicions she applied some tests on Autism and it's very likely I'm autistic too. But since she's not an autism specialist she was professional enough to suggest i search for a specialist to evaluate me better.,KelCesarVQ
2023-06-10 16:59:07+00:00,https://twitter.com/MarylinMangu/status/1667577142077423616,"I never understood more that it’s okay to need to be by myself. It’s okay to need silence. It’s okay to be overstimulated &amp; overwhelmed. 

I was diagnosed with autism. 

I experienced just how important it was to understand my differences. Understanding myself changed my life.",MarylinMangu
2023-06-10 15:57:59+00:00,https://twitter.com/scrawnypaws/status/1667561759517863937,"@nulcals introvert with social anxiety, for no reason?).. 
after I was finally diagnosed with adhd they suddenly thought they might have adhd as well (because they’ve been easily distracted and forgetful the last months back then… which is not what adhd is?",scrawnypaws
2023-06-10 15:09:26+00:00,https://twitter.com/Ivy_Pam_Quinn/status/1667549539467657217,@CatieOsaurus I was diagnosed with ADHD over 20 years ago. 3 years ago I figured out I am autistic. Now I'm wondering if I was misdiagnosed with ADHD 😳,Ivy_Pam_Quinn
2023-06-10 12:29:45+00:00,https://twitter.com/GuglioIs2Stupid/status/1667509355124604929,@DebonairTricks @Saeko_Cut I was diagnosed with odd and adhd and wasn't medicated so no...,GuglioIs2Stupid
2023-06-10 12:25:06+00:00,https://twitter.com/Repealist_/status/1667508182808158208,"@codenamewallaby Tbh I always thought, but it's when I had my Psychiatrist who diagnosed ADHD say it out of the blue,

'I don't know if you want to hear this, if it resonates, but you've traits consistent with what used to be called Asp*rgers, or the ASD spectrum'

and I was like, 'duh!'",Repealist_
2023-06-10 10:32:55+00:00,https://twitter.com/CrischarFoxito/status/1667479953779113986,@SubbyVipy I too was diagnosed with ADHD when I was 4 years old. And really if it is annoying to have this disorder.,CrischarFoxito
2023-06-10 09:57:23+00:00,https://twitter.com/shesavibe89/status/1667471011288080385,Turns out I’m not crazy. I was diagnosed with ADHD &amp; severe anxiety 😌😌😌 excited to feel normal soon.. Team Wellbutrin here I come,shesavibe89
2023-06-10 09:40:53+00:00,https://twitter.com/froggy_auggie/status/1667466857027084288,in 2020 i was diagnosed with generalized anxiety disorder which is probably just a lazy way of saying i have ADHD or autism or both,froggy_auggie
2023-06-10 06:02:05+00:00,https://twitter.com/markcraig789/status/1667411793655001089,"@momsstoptheharm @CANdrugpolicy @leslie_mcbain @LornaKay_Thomas @MsthPetra Moms
Please excuse my previous insensitive tweet.
I was told, half of the people struggling in the DTES have ADHD
I have Moderate ADHD
I have had cravings to get high ever since I can remember.
At age 35, I was diagnosed with ADHD. 
Medication helps lessen my impairment
(Cont)",markcraig789
2023-06-10 05:30:46+00:00,https://twitter.com/YosarianTwo/status/1667403913912360960,"@angelrightsnow Hmm, I'm more a ""ADHD and oppositional defiant disorder"" type  than any of those (I was diagnosed with both)",YosarianTwo
2023-06-10 04:28:22+00:00,https://twitter.com/justbrithingsss/status/1667388211922968576,When I was diagnosed with adhd last year not a single one of my friends were shocked. They all said “I know” or “duh”,justbrithingsss
2023-06-10 04:18:01+00:00,https://twitter.com/LilMewzer/status/1667385604366295041,"They really make a flag for everything…
(adhd appreciation flag.) 
Fun fact: i was actually diagnosed with adhd as a young kid :3 https://t.co/K4bLVcaGDd",LilMewzer
2023-06-10 02:43:30+00:00,https://twitter.com/THEMARSHALVANTH/status/1667361821156855808,"/ # 8 

I have adhd. I was diagnosed as a kid. Used to be my biggest secret and I hated myself for it. But I’m chill with it now. Stopped hating it a long time ago.",THEMARSHALVANTH
2023-06-10 01:45:09+00:00,https://twitter.com/MariVtuber/status/1667347134570717185,@ookaminaoko the biggest problem a lot of ppl with adhd struggle with is not knowing how to properly cope with their adhd symptoms and it's why i recommend seeing a professional who can help explain it better. it helped me a lot since i was diagnosed a few years ago and struggled a lot,MariVtuber
2023-06-10 01:36:21+00:00,https://twitter.com/angsty_mochi/status/1667344919617257472,@fochti I was diagnosed with nearly every single anxiety disorder at 14. I’ve been diagnosed with ADHD at 23 and looking for an autistic diagnosis currently.,angsty_mochi
2023-06-10 01:09:30+00:00,https://twitter.com/spaghettiass420/status/1667338162547355651,I’m only officially diagnosed with the adhd part of this but… yeah I’ve realized all the moments I thought I was having anxiety and panic attacks were really just autistic meltdowns. Had one last week and afterwards I was like “oh shit that’s what that is”,spaghettiass420
2023-06-10 00:45:08+00:00,https://twitter.com/_MissGreene_/status/1667332031452180482,"@paulajean2020 Plz forgive me, Paula I never meant it that way I have so much respect for you SO MUCH!  and I live with a disability as well, at age 11 in 2011 I was officially diagnosed with #ADHD my life changed from that point on. I should've used a different word, once again my apologies 💋",_MissGreene_
