Datetime,URL,Tweet,Username
2023-06-13 16:06:26+00:00,https://twitter.com/carla54837838/status/1668651048766930954,"@ADDitudeMag I was diagnosed with PMDD and ADHD 2 years ago,at the age of 49!Whilst in perimenopause.The symptoms for both conditions are sent off the scale during peri!Huge Trigger.I was also dx'd with Bipolar Disorder 18 years ago.The symptoms are also exacerbated too.Meds are ineffective!",carla54837838
2023-06-13 15:58:20+00:00,https://twitter.com/httpsean_ca/status/1668649010427740160,"Fun fact: My mom saw my ADHD video series last night and she called me. Turns out, I was actually diagnosed with ADHD when I was 2 years old but she said she hid it from me because she didn't want me to feel different from other kids.

She also didn't want other parents to stop their kids from hanging out with me. Filipinos in general (especially during that time) lump mental illness into this one category - ""crazy"" or ""baliw"" in Filipino. And the stigma is so bad that Mom told me that hopefully, I will outgrow it. 

She said that she's also thankful that I was able to decide now that I'm older and went through the diagnosis myself. She also acknowledges how at least now in Canada, we have better mental health support and resources.

She told me FUNNY stories hahahaha and it made me feel validated even more tbh, I thought I was just a hyperactive, overachieving kid when I was younger haha!

#ugccommunity #adhd #adhdawareness",httpsean_ca
2023-06-13 15:39:28+00:00,https://twitter.com/misslyss416/status/1668644260768518145,@autistic_dutske I have been ND my whole life with ADHD but diagnosed on the spectrum when I was 19/20 and I’m also 25! I’ve decided to start a podcast for women on the spectrum and other NDs,misslyss416
2023-06-13 13:45:34+00:00,https://twitter.com/smokey_paw/status/1668615596127453185,@psykhedelos i didn't know that but did start wondering if it was potentially asd when i was trying to figure things out so that makes a ton of sense! i was diagnosed with ocd a few years back ago but never really got to really work on it bc i was so focused on adhd,smokey_paw
2023-06-13 13:43:10+00:00,https://twitter.com/Light264Solaris/status/1668614994257391616,"@soulfirephoen1x Yes and now bc of your tweets I found my special interest which is psychology :)

(I’ve now been diagnosed with ADHD and generalized anxiety disorder, and I was also told by the neurologist that autism is also there)

Thank you for ND-truthing me like AGES ago XD",Light264Solaris
2023-06-13 13:30:33+00:00,https://twitter.com/ADHDLifeSimpli/status/1668611818623758337,"🚨It’s that simple.  ‼️

 ❓If you don’t know an ADHD adult, ask me.  🙋🏻‍♀️

 🧠 I was diagnosed with ADHD as an adult over 20 years ago. 😉

 💞 Join the ADHD community where I answer your ADHD questions. Click here: https://t.co/7iyPKuHxDX

#ADHDLifeSimplified #ADHDMoms #ADHDadult https://t.co/QReGO2MncL",ADHDLifeSimpli
2023-06-13 13:23:56+00:00,https://twitter.com/mar_btags/status/1668610153761865729,@autistic_dutske My new primary doctor and new therapist at the time actually just assumed that I was already diagnosed with adhd and autism and when I said I wasn’t they were very surprised so I went and got checked and they were right!,mar_btags
2023-06-13 13:08:08+00:00,https://twitter.com/Moon_Kittyxo/status/1668606177981222912,@autistic_dutske When I was younger I thought I had adhd and I was told not to be so “silly”. I went back to college as an adult and was told I should get an assessment for adhd and “potentially mild austism”. I didn’t think I had autism but I’ve now been diagnosed with ASD at 30🌻,Moon_Kittyxo
2023-06-13 12:46:34+00:00,https://twitter.com/myADHDcareer/status/1668600750132322304,"The weirdest thing about my journey with an ADHDdx has been that I've had 3 diffrent therapists for 5+ months but then all of a sudden I was out of sessions and it was like 'you're on your own now, good luck with your life'...",myADHDcareer
2023-06-13 12:39:04+00:00,https://twitter.com/reuthegamer/status/1668598861852467200,"Last night I had my formal ADHD assessment and, surprising few at this point, I was diagnosed with combined type ADHD. To be honest, after two and a bit years, I mostly feel just relieved about finally actually knowing. Carrying around such a heavy question mark has been tiring.",reuthegamer
2023-06-13 11:29:43+00:00,https://twitter.com/drewrowan_NSFW/status/1668581408036515840,"@TheSirDax This sounds a lot like how I get sometimes about my autistic special interests. In the past I have spent money I didn’t have and neglected work or other responsibilities to pursue an interest, which passes after a few weeks or so. Last year I was diagnosed with ADHD…",drewrowan_NSFW
2023-06-13 11:11:00+00:00,https://twitter.com/mangoeTWO/status/1668576700148613121,"saw oomf mention diagnosis in this question too i wasnt diagnosed until recently when, after the third professional listened to me, i was recognised as autistic with adhd - im working on official papers but itll take a while bc the person i need to see is busy",mangoeTWO
2023-06-13 11:00:40+00:00,https://twitter.com/TSUKlNOYORU/status/1668574097964408835,I was diagnosed with adhd at a very early age but for a long time i had a very strong suspicion that i was also autistic but it took a lot of convincing so i finally got a diagnosis at 16 :),TSUKlNOYORU
2023-06-13 09:30:31+00:00,https://twitter.com/mltvrslmrchntVT/status/1668551412085604355,"I was diagnosed with ADHD and was treated with medication on and off for years trying to find a good match. I was never accommodated for it, just was given a treatment and told to work with what I got.

But, I got used to it. (3/?)",mltvrslmrchntVT
2023-06-13 08:32:00+00:00,https://twitter.com/ABCsofADHD/status/1668536684575596544,"One thing I'd add is that the intensity at which I feel these emotions is the same as before I was diagnosed.

What has improved and helped is learning coping mechanisms to manage my reactions to them. 

(Meds don't help with intensity for me, but does help me focus on coping)",ABCsofADHD
2023-06-13 07:44:37+00:00,https://twitter.com/collynahart/status/1668524760752353281,So. I was recently diagnosed with ADHD and high functioning ASD. Over 15 years ago I had suspected I had autism but felt so much shame around it that I convinced myself if I could change my behavior then no chance I actually had ASD (ha!).,collynahart
2023-06-13 07:33:39+00:00,https://twitter.com/camilla_gea/status/1668522001068171266,"@AmberlynWhite @jimilne They would just remind me to pay attention if I was too distracted, or remind me afterwards about homework they had mentioned mid class that I had missed. They actually did care about how I was feeling and coping, even when at that time I was only diagnosed with ADHD.",camilla_gea
2023-06-13 07:12:27+00:00,https://twitter.com/ramravz/status/1668516668363132928,NOT MY PARENTS HIDING THAT I WAS DIAGNOSED WITH ADHD WHEN I WAS 4 YEARS OLD 😭😭😭 IT WASN'T A PHASE PLS--,ramravz
2023-06-13 06:48:25+00:00,https://twitter.com/TheWonhwa/status/1668510619182727168,"Diagnosed with RAD, ADHD, PTSD and bi polar in that order starting at age 6 ending at 11/12. Naturally, after I was adopted I was thrown in to therapy and medicated-Heavily. I haven’t taken meds since mid HS and truly don’t believe I could have had such Dx’s, so young.",TheWonhwa
2023-06-13 02:43:41+00:00,https://twitter.com/Atzfyi/status/1668449029171318784,"I was uhh a really bad child when I was younger.....I think I had Intermittent explosive disorder (IED)
But was never diagnosed...all I was diagnosed with was ADHD/ADD",Atzfyi
2023-06-13 02:19:41+00:00,https://twitter.com/agirlcalledmel/status/1668442988866043905,"@trumanblackblog genuinely second this, got one before I was diagnosed with bipolar and adhd lol so many regrets",agirlcalledmel
2023-06-13 01:30:04+00:00,https://twitter.com/Atzfyi/status/1668430503127715841,"@juyeonverse2 Adhd has hyperactivity and ADD doesn't 
(I was diagnosed with adhd when i was younger but now I lean more on add)",Atzfyi
2023-06-13 00:04:53+00:00,https://twitter.com/grxcefxce/status/1668409067809935360,"This is such a good point. I wasn't diagnosed with ADHD until 25 because I hid it so well by being overly proactive (though, the reason I got diagnosed then is because I was finally getting burnt out from this and less able to do that) in order to function ""normally.""",grxcefxce
2023-06-12 23:49:35+00:00,https://twitter.com/joshahull/status/1668405213550592011,"@Tarkirr I was diagnosed with ADHD when I was very young, they had me on Ritalin that stuff made me suicidal, and I haven’t been on anything ever since. Best of luck",joshahull
2023-06-12 23:45:29+00:00,https://twitter.com/jodiiewhittaker/status/1668404184398348291,"@DUSKdev for all these long years i thought there's something wrong with me, and it's just both GAD and depression i was diagnosed with in 2017. doctors blaming everything on these two was my biggest fear about getting looked at re ADHD, but thankfully they took me seriously, and since -",jodiiewhittaker
2023-06-12 23:41:13+00:00,https://twitter.com/spookylyssa/status/1668403111906492416,@auntieserver i've been diagnosed with adhd since i was 5 and they don't even diagnose that young 💀,spookylyssa
2023-06-12 22:25:34+00:00,https://twitter.com/eternallyeros/status/1668384073230811139,i was diagnosed with ADHD today and it just makes me laugh bc for months certain people told me “well i can’t do that i have ADHD” when in reality it was laziness and a lack of effort and weaponizing a mental illness to make themselves look like victims. crazy isn’t it,eternallyeros
2023-06-12 21:59:58+00:00,https://twitter.com/Fatty_Melt/status/1668377627474755590,"Every day I find another thing that I've done since childhood is most likely ADHD/autism. I wish I could go back to the quack shrink who took my $700 and diagnosed me with anxiety because I was ""too smart to have ADHD"" and tell her to get a different job 🙃",Fatty_Melt
2023-06-12 21:40:01+00:00,https://twitter.com/StrawberryVotes/status/1668372607865896966,"@adamfare1996 This is part of how I was diagnosed with ADHD too. That and moving out of my parents house and into my own house made it super obvious. I now have a person come once a month to help me out with cleaning and organizing because I can't keep up with myself 🫣.

WFH was 😍 to me.",StrawberryVotes
2023-06-12 21:08:52+00:00,https://twitter.com/AstroMasked/status/1668364768086818818,"I was not ""diagnosed"" with adhd, it's just part of my lore. It's cannon, wym mental illness? I call that a debuff my guy",AstroMasked
2023-06-12 19:52:03+00:00,https://twitter.com/Tarkirr/status/1668345440188911618,I set up an appointment with my physician for an ADHD diagnostic and recommendations. Ive been diagnosed with ADHD before when I was younger and was put on Ritalin medication and it made it hurt to sit still. I want to see if there are other alternatives if I do really have it.,Tarkirr
2023-06-12 18:43:11+00:00,https://twitter.com/DarkMalicex/status/1668328105939968000,"@HumanbeingAwk I'm the skeleton at this point. I was diagnosed at 37. I have 3 children, 2 of them have been diagnosed ASD and ADHD. Everyone insisted they didn't have ADHD...funny how 2 years later they suddenly decided I was right. In pre-school its not as easy to tell with girls, but after",DarkMalicex
2023-06-12 18:15:41+00:00,https://twitter.com/Amity_Blight128/status/1668321184927330304,"@dumbdagger all of this but id like to add that i was incorrectly diagnosed with it, my ""ODD"" started and ended with not doing things if i didnt understand why i had to do them - i wasnt violent. ive heard it was normal for girls in the 2000s to get diagnosed with ODD rather than autism/adhd",Amity_Blight128
2023-06-12 18:07:34+00:00,https://twitter.com/lolambie/status/1668319143215366158,@AgentTex1973 They originally wanted to diagnose me with anxiety (already had been diagnosed) with dr sadek but I was like uh no I just need adhd meds. Dodged a bullet.. sort of..,lolambie
2023-06-12 18:02:36+00:00,https://twitter.com/httpsean_ca/status/1668317892490973189,"👉🏻 NEW SERIES ALERT! Last May, I got diagnosed with ADHD (I thought I was depressed but it was actually ADHD) and as mentioned in my Discord community...

I’ll be starting a new series talking about my ADHD diagnosis, but more importantly, some ADHD hacks that I implement as a creator/entrepreneur as well as some facts about ADHD in women and why a lot of adults are undiagnosed.

Link to the TT playlist + IG Reel in the comments!

#ugccommunity #ugc  #ugccreator #adhd #adhdawareness",httpsean_ca
2023-06-12 17:43:15+00:00,https://twitter.com/tradwifeobama/status/1668313023054766082,"@DUSKdev Hey man, I'm just some guy who likes your games, but I want you to know that this means a lot to me. I was lucky enough to be diagnosed with ADHD as a kid but as an adult, there's definitely other stuff going on making my life extremely hard. I'm going to get that checked out.",tradwifeobama
2023-06-12 17:23:01+00:00,https://twitter.com/Shi_ADHD/status/1668307932495347712,"getting diagnosed at the last year of my undergrad makes me think about all the what ifs, including ""could i have gotten a better GWA if only i was diagnosed earlier?"" i really struggled with studying and organizing my studies...

#adhd #Neurodivergent",Shi_ADHD
2023-06-12 16:46:26+00:00,https://twitter.com/Tarantrinn/status/1668298724576047126,"My first therapist correctly diagnosed me with ADHD but when I brought up the fact previous professionals and my own parents who’ve been around me for- at that time- 21 years of my life were dead certain I was autistic, looked me dead in the eye and said I couldn’t be",Tarantrinn
2023-06-12 16:38:52+00:00,https://twitter.com/JetpackButter/status/1668296820869545985,I’m so relieved that I’ve been diagnosed with ADHD like I knew I had it but some part of me thought I was faking it,JetpackButter
2023-06-12 16:21:13+00:00,https://twitter.com/ElsaSk8s/status/1668292382201094146,"@lamm_sam @adamfare1996 Yes! I was diagnosed with ADHD at 50 because having everyone home 24/7 during the pandemic destroyed all my coping mechanisms. I'm still trying to get some of those back in place, but at least now I have a bit of ""better living through chemistry"" help. 💊",ElsaSk8s
2023-06-12 16:14:58+00:00,https://twitter.com/acciopatronus10/status/1668290809328816128,"@WeAreAutastic I was also diagnosed with many other things, including ADHD, PTSD, depression, anxiety, and sensory processing disorder. I have gone my whole life feeling misunderstood, which prompted me to do my own research. I am grateful I did.",acciopatronus10
2023-06-12 16:14:04+00:00,https://twitter.com/aboomination1/status/1668290581120835584,"@ADDiane @autismsupsoc Tbh, I was in the same boat. Before I was sent down the ""strange NT to diagnosed with ADHD pipeline"" (via a gentle nudge from an AuDHD wizard), Autism just did not happen in my world, at all.",aboomination1
2023-06-12 15:54:28+00:00,https://twitter.com/carleynmartin/status/1668285649370198020,@adamfare1996 Oh absolutely! I was so confused why things all of a sudden were so difficult for me and then I got diagnosed with ADHD and was like ohhhhh,carleynmartin
2023-06-12 15:47:22+00:00,https://twitter.com/Passie_Kracht/status/1668283860470120454,"@_sconsolato @authenticTERF @inmyownfashion2 Diagnosed with ADHD last year at age 54. I thought I was dumb/lazy/disorganised all this time. Daughter got diagnosed too, was told by many teachers she could ""do better"" but no one thought to have her tested for ADHD :/",Passie_Kracht
2023-06-12 13:23:34+00:00,https://twitter.com/conquerthethorn/status/1668247671306440704,@PragmtcSanction @val_herman1 @adamfare1996 Exactly. In the 90s as a kid I was diagnosed with a ‘non specific learning difficulty’ and ‘poor working memory’ enough to get me extra time on tests but no additional help. It was clearly ADHD. I just feel sad for my younger self because I coped but felt wrong.,conquerthethorn
2023-06-12 12:55:53+00:00,https://twitter.com/superechnik/status/1668240708593938434,"@WeAreAutastic I was diagnosed with ADHD, GAD and they tacked on Agoraphobia to explain away the sensory issues about 20 years ago. Didn’t consider ASD until this year but saw myself in online depictions and it was revelatory",superechnik
2023-06-12 11:03:55+00:00,https://twitter.com/grahamlutz/status/1668212529992966148,"@chargrysolle “Be realistic.” - this was the idea that has been most helpful for me. 

I was diagnosed with ADHD last fall and it’s made my entire life make sense. And now I’m approaching all my new projects are goals with that lease, and building that understanding into my approach.",grahamlutz
2023-06-12 11:03:17+00:00,https://twitter.com/AnsaldoJ_/status/1668212367987974147,was diagnosed with autism when I was like 14. always thought I had some adhd tendencies. Reading through the overlap really opened my mind as to stuff that I do that Autism doesn't seem to cover.,AnsaldoJ_
2023-06-12 10:37:43+00:00,https://twitter.com/netnite/status/1668205935028756487,"@VigilantFox @DrEliDavid @elonmusk I was instructed to give him Tempra (Tylenol) and he was diagnosed with ADHD and LD.  Hard, hard years followed.I am grateful to say he has fully recovered..but our lives were irreparably impacted.  I will never forgive them for this .",netnite
2023-06-12 08:19:05+00:00,https://twitter.com/Letterhythm/status/1668171046242111489,@shahh I was recently diagnosed with ADHD. The answer for all my problems I've been facing for years. so GG,Letterhythm
2023-06-12 07:56:13+00:00,https://twitter.com/MS8343428187371/status/1668165292948586497,"I was just diagnosed with ADHD at age 30. I am working with medical professionals and my therapist to find the right balance of medications and coping mechanisms to be successful, but I am also trying to be thoughtful about my career and how best to set myself up for success.",MS8343428187371
2023-06-12 06:56:26+00:00,https://twitter.com/EllesPancakes/status/1668150249225846784,@AmberlynWhite And HOLY SHIT does the list go on I am so glad I was able to get diagnosed with autism and ADHD when I did even if the autism diagnosis would've helped before I hit my teens. I'm still a baby (17) but everytime I think of my early childhood I'm just like HOW. HOW DIDNT YOU KNOW!?,EllesPancakes
2023-06-12 05:15:21+00:00,https://twitter.com/Scandanav_Queen/status/1668124809761550337,"I was diagnosed with ADHD about 14 years ago.

If you don't understand what that means to brain chemistry, you might want to google it BEFORE embarrassing yourself by making up OBVIOUS LIBEL.

Only truly stupid idiots would PRETEND opposite brain chemistry. 🤨",Scandanav_Queen
2023-06-12 02:31:23+00:00,https://twitter.com/jamirvalentine/status/1668083547767205889,@Andtism I was diagnosed with ADHD and ADD and I wonder the same things sometimes,jamirvalentine
2023-06-12 01:55:49+00:00,https://twitter.com/bluey_soda/status/1668074593884438529,"I was diagnosed with ADHD last November in my sophomore year of high school. And the opposite was true for me- I struggle with both severely. I have to be in a learning environment away from distractions to ATTEMPT to work, and distance learning made that difficult.",bluey_soda
2023-06-12 00:02:57+00:00,https://twitter.com/zero_the_source/status/1668046191588945920,"@Amy67683519 @jeryncambrah @adamfare1996 So THAT'S why I always skipped lunch to hide in the library when I was in school! I was having sensory overload! I was even diagnosed with ADHD in middle school, but school staff thought it just meant I couldn't pay attention without one of those desk partitions 😑",zero_the_source
2023-06-11 23:09:50+00:00,https://twitter.com/stxrwisp/status/1668032823096221700,"i was diagnosed with autism when i was 13 by a psychiatrist, therapist, and a doctor and now im 21 and wondering if i have adhd. :0 
at this point it isn't worth it to get rediagnosed bc medicine didnt do anything for me, so it would just be for the label :/ #autism",stxrwisp
2023-06-11 22:24:39+00:00,https://twitter.com/grahamlutz/status/1668021453768343554,@jenwiderberg I remember calling…getting distracted…missing the movie I was calling about…calling again…getting distracted…and I got diagnosed with ADHD last year lol,grahamlutz
2023-06-11 22:17:25+00:00,https://twitter.com/wankanapocalae/status/1668019632098385921,Thinking a lot about how ADHD and Autism have so much in common and I was diagnosed with ADHD as a child but Ritalin just made me shut down so I was taken off it after a week when I was a kid and no one tried to diagnose me again today.,wankanapocalae
2023-06-11 21:53:23+00:00,https://twitter.com/okay_birdie/status/1668013584310214662,I’m FINALLY diagnosed with ADHD. It’s been YEARS since I knew what was wrong with me but nobody wanted to believe me because I’m fucking great at masking. My life became a nightmare because of my brain. I was so tired and so lost. I finally found an opportunity to be diagnosed/,okay_birdie
2023-06-11 19:21:44+00:00,https://twitter.com/BenBede/status/1667975422712115201,"Just over two years ago a tutor suggested I be referred for a Specific Learning Difficulty assessment. Just under two years ago  it was suggested that I might have/live with (I’m still not sure how to talk about it) ADHD. This week, I was diagnosed with ADHD (Combined).

2/9",BenBede
2023-06-11 18:58:54+00:00,https://twitter.com/roche_toni/status/1667969673747374081,"@rosewell1983 @cbucksrules A couple of years ago I was diagnosed with PTSD and last year, high functioning autism.  All my close friends knew but me!
Now they want me to get tests for ADHD. But it won't change anything 😅
Xx",roche_toni
2023-06-11 17:28:55+00:00,https://twitter.com/_Savage_Savvy_/status/1667947030650527748,"@lasrina Mind you I've been off and on meds since I was 9. I'll be 33 in August. I know when I need them and when I don't. 
But I have an appointment in October and will talk about ADHD meds since I do rollercoaster. Diagnosed at age 2 with it.",_Savage_Savvy_
2023-06-11 14:14:38+00:00,https://twitter.com/KuroharuXIV/status/1667898138672369665,"@SilLili_babies I was once diagnosed with no ADHD because i fucked up the diagnosis on the sole fact i never took notice on things that the doctor was mentioning and was spitballing shit

I am still convinced i have ADHD https://t.co/ovpUH2YSPl",KuroharuXIV
2023-06-11 14:14:01+00:00,https://twitter.com/YosarianTwo/status/1667897982870597639,"@Saeko_Cut Neah, I was diagnosed with ODD (and ADHD) as a teenager and it was pretty accurate.",YosarianTwo
2023-06-11 10:38:27+00:00,https://twitter.com/razorburns_/status/1667843732987604994,"y'all i was diagnosed with add like almost 3 years ago and until yesterday, i didn't know it was an outdated term for adhd. I AM SUCH AN IDIOT. ME AND MY SISTER WOULD ALWAYS JOKE I HAD UNDIAGNOSED ADHD BUT NO !! I HAD IT THE WHOLE TIME !!!!",razorburns_
2023-06-11 08:37:04+00:00,https://twitter.com/kimsoonkyu36/status/1667813186492596224,"@danidonovan @duolingo I was diagnosed with ADHD and from what I understand, and what I've experienced, it's not about not wanting to do something. I want to clean. And I do clean things. It's about not being able to finish cleaning as planned. I'm not affected by this because there ARE lazy people ..",kimsoonkyu36
2023-06-11 05:45:38+00:00,https://twitter.com/ashleyann_atx/status/1667770044112162816,@MamaCassOFee @LegallySwin I was also diagnosed with ADHD inattentive type. Also anxiety. I don’t think it explained the whole picture.,ashleyann_atx
2023-06-11 05:30:27+00:00,https://twitter.com/rozencasket/status/1667766220479774722,"Does anyone know if i can get prescribed adhd meds if i dont have an adhd diagnosis? 

I was diagnosed with “autism with inattentive adhd traits” SPECIFICALLY. I really have attention problems and i hear so many people say stuff like adderall made a giant difference in their life",rozencasket
2023-06-11 04:59:02+00:00,https://twitter.com/ChildOfPolaris/status/1667758315353284609,"@MrMAD64 @fochti ^I mean....some days it feels like that, lol. (I was diagnosed with audhd/ both autism and adhd)",ChildOfPolaris
2023-06-11 03:44:07+00:00,https://twitter.com/koalachelsz/status/1667739463626178560,@fochti Okay WAIT. I was recently diagnosed with ADHD and got put on wellbutrin because of the stimulant shortage &amp; my doc said to 'start less harsh' but I'm past month 1 and it hasn't been.. doing much but ppl tell me to keep waiting. What med works for you that you got?,koalachelsz
2023-06-11 03:40:18+00:00,https://twitter.com/JunerDoza07/status/1667738502367428608,"@kim_gannon_ As a person with ADHD, diagnosed at an adult age, man…it’s so complex. I understood completely when you said you felt isolated. Or the fact that you mentioned “normal.” Sports and music helped me growing up. Like you, I was good in school. So my ability focus does challenge me.",JunerDoza07
2023-06-11 03:32:27+00:00,https://twitter.com/feasibleweasel/status/1667736526887829506,"I say it all the fucking time but I was diagnosed with bipolar on my first appointment with a psychiatrist and when I went for adhd/autism eval they said I didn’t have it because I was well dressed, showed up on time, am bilingual, and knew a lot of fun facts",feasibleweasel
2023-06-11 03:22:51+00:00,https://twitter.com/mochikzzu/status/1667734109525794816,@fochti I was diagnosed with adhd at 4 and it's severe and some dumbass doctor said that I don't have adhd I just have bpd 🧍‍♀️💀,mochikzzu
2023-06-11 03:19:30+00:00,https://twitter.com/ekydrd/status/1667733266810511360,"@jonathanstea I’m almost 60 and was diagnosed with ADHD when I was about 25. There wasn’t a name for it when I was a kid, but I had all the symptoms.",ekydrd
