Datetime,URL,Tweet,Username
2023-06-18 23:14:25+00:00,https://twitter.com/LightPhoenix00/status/1670570694713720832,@spacekat88 I was diagnosed with ADHD https://t.co/6SsN4tCn8S,LightPhoenix00
2023-06-18 23:12:06+00:00,https://twitter.com/Clarum_Somnium/status/1670570110942158848,"Personal story: I was diagnosed with ADHD at the age of 10. My parents mostly disregarded it and provided me with no medication or other support. If anything, they used my diagnosis as an excuse for my poor behavior at school which, while valid, was also self-serving.",Clarum_Somnium
2023-06-18 23:09:31+00:00,https://twitter.com/tedbouskill/status/1670569458371313668,@DevonJHall I grew up with two parents that had ADHD. Didn't realize it until after I was diagnosed 10 years. I just thought that it was normal,tedbouskill
2023-06-18 20:46:52+00:00,https://twitter.com/TheRoseaSword/status/1670533559868858368,"@OathkeeperLexi whats really interesting was when i was diagnosed with autism they werent testing exclusively for it, so im surprised in retrospect to learn i dont have adhd, even if mine doesnt fit as much criteria as most others with adhd",TheRoseaSword
2023-06-18 20:43:39+00:00,https://twitter.com/originaltweritt/status/1670532750300925956,"@fochti I was diagnosed with adhd at 51 - there’s a pretty big backlog of people, especially women, getting diagnosed at the moment. It’s so frustrating to try to cope with this at the same time as people are calling it a trend",originaltweritt
2023-06-18 19:52:43+00:00,https://twitter.com/HuskyAka/status/1670519931153321985,@fochti But I do have ADHD I was diagnosed with it by a professional,HuskyAka
2023-06-18 16:42:14+00:00,https://twitter.com/RookietheGoat/status/1670471994515636225,@ehimeora This! When i was 5-6 yo i was obsessed to be a doctor. Then it fade away because my undiagnosed adhd and troubles with learning boring stuff. Now many years later and diagnosed i cry because i've wanted to be a doctor but it's too late :(,RookietheGoat
2023-06-18 16:29:58+00:00,https://twitter.com/st0rmr8ge/status/1670468911622488064,"I was diagnosed with ADHD at 7 years old and stopped taking meds at 12 because they zombied me out. 
I swear like I’m from Boston (I AM!)
Planet Fitness stole my motto of being a judgment free zone. 
I also have depression so if I’m quiet I feel like I’m bothering you.",st0rmr8ge
2023-06-18 15:49:13+00:00,https://twitter.com/_jb1982/status/1670458654691131393,@Mollys_ADHD I was diagnosed with ADHD in 2021 and still sometimes wonder where I could have been if I had the ability to concentrate in school and study.,_jb1982
2023-06-18 15:39:25+00:00,https://twitter.com/Mollys_ADHD/status/1670456189178593286,Did any Late diagnosed Neurodivergents experience a period of denial and grief after their diagnosis? I was diagnosed with ADHD at 21 and then as Autistic at 23… I went through it with my Adhd diagnosis almost instantly but a year on from my Autistic diagnosis Im now i’m denial,Mollys_ADHD
2023-06-18 15:12:36+00:00,https://twitter.com/nbsurprise/status/1670449440555925504,"@Haderai43 i was diagnosed with autism at age 3 or something lol, never adhd tho",nbsurprise
2023-06-18 15:11:12+00:00,https://twitter.com/MaxxieArts/status/1670449085952970753,"@dm_noID I was diagnosed with ADD (ADHD) probably around 10 or 11. Hard time at school and at home so my mum took me to the doctor to get checked.  I didn't there was much ""wrong"" with me till the people around me made a big fuss about it",MaxxieArts
2023-06-18 14:44:38+00:00,https://twitter.com/AuroraTheAvali/status/1670442403445235712,"@dm_noID I knew i had ADHD since i was a little kid, cause i was diagnosed with it, but the autistic part was a different story.
I was told i was ""borderline Aspergers"" (ASD), but i am fairly certain they missed things... probably because i was masking",AuroraTheAvali
2023-06-18 14:11:55+00:00,https://twitter.com/GoldJenny67/status/1670434167132135424,When I was in third grade I was diagnosed with a depressive form of adhd so I wonder if that's part of it. Idk I've had people guess at what's wrong with me my whole life. 🤷🏻‍♀️,GoldJenny67
2023-06-18 13:01:54+00:00,https://twitter.com/_rebecca_la/status/1670416549813911553,"@autismsupsoc He might be???? He's certain he would have been diagnosed with ADHD as a kid, ""but I was just a normal hyperactive boy"". 🤦‍♀️ I see some of my AuDHD-ish things in him though so perhaps he's both?",_rebecca_la
2023-06-18 12:20:21+00:00,https://twitter.com/TheDream_trader/status/1670406093351055362,"@Jackystarlet @davenewworld_2 I I was 💔😩🥺 diagnosed with PTSD, ADHD i had several panic attacks both depression and anxiety so I decided to try a new phycadelics and it's helpful reach out to [Psychelicz_shop]on IG 💯✅✈️🍫🍄",TheDream_trader
2023-06-18 11:31:19+00:00,https://twitter.com/Cosybeans_/status/1670393753419251713,"Happy #AutisticPrideDay ♾️🏳️‍🌈

I was a very recently diagnosed with autism and I also have adhd! I am just s game loving polysexual streamer  who is still learning a lot about my autism but always open to talk about it❤️",Cosybeans_
2023-06-18 11:11:31+00:00,https://twitter.com/lexiidaisiee/status/1670388769717878784,"@NaomiFromATIM @TommyLavinTST @ask_aubry And yes I am diagnosed with PTSD depression  and GAD since I was 15. Trouble with PCOS as well. Might have some adhd. Maybe post partum but regardless, get up and take care of you and yours. I know it’s hard, but that’s what makes it worth while",lexiidaisiee
2023-06-18 08:42:56+00:00,https://twitter.com/Kari_Bear/status/1670351377179058179,@Shann_Shortcake You should read about women with autism. I was diagnosed with adhd first and autism a year ago. I was like omg I’ve been self blaming and thinking I just need to try harder for so long! Look up tony Attwood aspergers in girls on YouTube 💜,Kari_Bear
2023-06-18 07:12:06+00:00,https://twitter.com/DespicableCHs/status/1670328517483962368,"@RingzMoody YAY :D 
To be fair, I was formerly diagnosed with bpd (it as a mistake, the therapist who diagnosed me knew me for a month and my new therapist said uhhh...  what? And then she was like, maybe you should get checked for ADHD and Autism, and I was like Oh)",DespicableCHs
2023-06-18 06:16:31+00:00,https://twitter.com/decaymanagement/status/1670314530096975872,"Here’s an extraordinary thing:
Not long after I was diagnosed with ADHD and started taking Ritalin, well, I abducted an alien and kept it in my office for 6 weeks. It looked like Jabba the Hutt, constantly wanked its bits (it had M AND F bits) played D&amp;D 24/7, and stole my Rits!",decaymanagement
2023-06-18 05:56:40+00:00,https://twitter.com/LordShween/status/1670309534911299585,"@tooothpeck oh yeah ofc definitely i self diagnosed myself with adhd cuz i saw people with similar experiences and stuff then did my research and went through as many processes as i could and all of the descriptions matched

i was just saying they read the post and self diagnose and shit",LordShween
2023-06-18 05:48:33+00:00,https://twitter.com/erinchavi/status/1670307492495015936,every time i bring up angels and my cassandra curse on the tl there's a little piece of my brain that's like you need to shut up you need to shut up right now and that is why i did not get diagnosed with ADHD until i was 17,erinchavi
2023-06-18 01:01:42+00:00,https://twitter.com/SerranoArts/status/1670235304433790976,"@kowlraxx i dont even know if i have ADHD cause I was never officially diagnosed, like bi polar, I just have some of the signs

the only thing i was ever officially diagnosed with is high functioning autism",SerranoArts
2023-06-18 00:30:15+00:00,https://twitter.com/LoshadSpaceport/status/1670227388960227335,"@spargles When I was a kid, I was diagnosed with autism and ADHD. I was even brought to a speech coach to learn to talk.

I only realised it when I was an adult, especially since I can't focus well",LoshadSpaceport
2023-06-17 23:03:57+00:00,https://twitter.com/JudithAB70/status/1670205671923671043,@ADDitudeMag I worried about the same thing before I was diagnosed with ADHD (at the age of 69).,JudithAB70
2023-06-17 22:55:12+00:00,https://twitter.com/KMarshallATC/status/1670203468659806210,"My mom: you’ve never had a filter and are my wild child.
Me: well, maybe I wouldn’t have been wild if you had me tested and diagnosed with ADHD as a kid instead of me waiting until I was 27…
My mom: you turned out fine, didn’t you, doc

I love her but damn, stop gaslighting me!!",KMarshallATC
2023-06-17 22:28:36+00:00,https://twitter.com/hispolestar/status/1670196774311452679,"sorry my therapist said i don't have adhd, she just diagnosed me with high iq (i fucking wish i was joking) https://t.co/w2OJZS8vx7",hispolestar
2023-06-17 21:56:10+00:00,https://twitter.com/atty1chgo/status/1670188612950843396,"@beadbop @JonesMurphy @MarchandSurgery @FrankJRanelli @caity2shoes I was diagnosed with ADHD at age 50 as the result of this disciplinary action which was 17 YEARS AGO. As it turned out, this action was a real lifesaver, as I was previosly undiagnosed. Do you have a problem with that, fartbreath? Or is that psych degree a pile of crap?",atty1chgo
2023-06-17 21:43:06+00:00,https://twitter.com/teachechick/status/1670185324184498176,"@ShannonBiersack I was diagnosed BPD, then this was changed to autistic. I thought you were implying that I didn’t know what a BOD diagnosis is like. I just find society is better with me being autistic. When I had a disordered personality people backed away from me.",teachechick
2023-06-17 20:27:07+00:00,https://twitter.com/presspause87/status/1670166202604290048,"@transmedscum Sigh. Kelly has gone off the rails. There’s nothing wrong with pathologizing mental health issues. I have diagnosed CPTSD, OCD, ADHD, depression &amp; anxiety. I’m thankful to have my doctors that help me work thru it. Before I had them and meds I was miserable",presspause87
2023-06-17 20:23:49+00:00,https://twitter.com/GoldJenny67/status/1670165371557490693,"When I was in 3rd grade, I was diagnosed with the ""Eeyore syndrome"" as if I wouldn't understand was depressive ADHD means. 🙃",GoldJenny67
2023-06-17 19:39:12+00:00,https://twitter.com/SummerNazif/status/1670154142252253184,"@hangryliving Yeah, I was punished and villainized for my ADHD symptoms. When I got diagnosed at 20, everything made sense, but I was bitter because y’all could’ve just got me help but instead you filled my head with negative beliefs about myself I still struggle to let go of",SummerNazif
2023-06-17 17:42:45+00:00,https://twitter.com/Koodleskoo/status/1670124837614891010,"@PaulaMc007 Done! By an ex @BritishCouncil teacher who  is well aware teacher training
in neurodiversity is appalling. That appalling, when I was diagnosed with ADHD at 42, while 6 months pregnant and high risk, they sacked me. 🙏🏻",Koodleskoo
2023-06-17 17:04:27+00:00,https://twitter.com/jonathan_cilley/status/1670115201591529475,@_Soda_Station @adhd_ffs I got diagnosed with ADHD later in life (I was 38). I take Concerta for my ADHD and I find it to be very good. It actually helps my anxiety a bit as well. Only thing that I need to be careful about is my caffeine intake while taking the meds. Might be worth a look.,jonathan_cilley
2023-06-17 14:29:12+00:00,https://twitter.com/kuromibatwings/status/1670076129435058177,"@_caIphomet_ i dont think ppl with just adhd should say it (especially not towards other people) but this tweet reminded me of how someone i used to be friends with tried to convince my other friends that i self diagnosed autism ""so i can say the r slur""... when i was diagnosed as a kid 💀",kuromibatwings
2023-06-17 14:04:04+00:00,https://twitter.com/sovtoshi/status/1670069806371045376,"@GHOSTawyeeBOB I was diagnosed with ADHD at 23. It made a huge difference in my life. I also think I would have accomplished far more in life if I would have known why I couldn't focus in school. I self medicated with illicit drugs to try and focus. It was a mess. 
So GFY",sovtoshi
2023-06-17 13:06:26+00:00,https://twitter.com/michelle__703/status/1670055301389729794,"My daughter was just diagnosed with adhd. I have it. My older child has it. My parents suffered with mental illnesses. I was hoping I was wrong with thinking she had it too. She also most likely has my eye disease. 
I feel awful like I failed her.",michelle__703
2023-06-17 12:43:11+00:00,https://twitter.com/y00njinlvr/status/1670049451074015239,in 2019 i was in the worst place I’ve ever been in. dealing with abuse and getting diagnosed with adhd/anxiety. I stumbled across a video of bts and it changed my life for the better 💜 they have more of an impact on me than they’ll ever know https://t.co/DCXpHYLWUn,y00njinlvr
2023-06-17 12:38:52+00:00,https://twitter.com/Abimbola_OT/status/1670048365122387970,"Part way through my masters I was diagnosed with ADHD &amp; specific learning disabilities. It was difficult, I failed many modules &amp; it took a knock on my confidence. I graduated with a 2:2. I’m now 8 months in NQ. Your degree classification DOES NOT define you! ❤️",Abimbola_OT
2023-06-17 08:21:41+00:00,https://twitter.com/AnnCastleWalton/status/1669983643035394048,"This has been another edition of: Ann, she is forgetful 🤣

I need lists to remember things. I also need lists to remember to put things on the lists 🤣

Yes I was recently diagnosed with ADHD, why do you ask? 🧐",AnnCastleWalton
2023-06-17 08:14:16+00:00,https://twitter.com/WatcherXandea/status/1669981773042794497,"I’ve also never been diagnosed, but interestingly enough, most of this is stuff I’ve been doing since I was a literal toddler. I didn’t know so much of it was associated with ADHD https://t.co/XqRfrMF6cf",WatcherXandea
2023-06-17 02:56:17+00:00,https://twitter.com/lowbai/status/1669901752148058112,"@hankgreen HANK! I was like this too, then I got diagnosed with adhd and once I started taking medication the radio in my heard turned off!",lowbai
2023-06-17 02:15:00+00:00,https://twitter.com/crawl_n/status/1669891362202722305,@JamaicanGirl_Jo @ReelzChannel @peacock @OfficialOPLive When I was diagnosed with ADHD about 27 years ago the doc said Alcohol increases the issue. I haven't had a drink since. Don't miss it either #OPLive,crawl_n
2023-06-17 00:31:53+00:00,https://twitter.com/james__searles/status/1669865410827567104,"@ThomasBeautyy fair, i was recently diagnosed and stimulants have been a great change for me.  are you still treating your adhd with any medication at all? and if you are, would you be comfortable sharing? treating my adhd has been life changing but i’m not trying to take adderall my whole life",james__searles
2023-06-16 23:30:11+00:00,https://twitter.com/Damooshiefarmer/status/1669849883354992640,@IncognatoDD @celticguy357 @FleecingAmerica @VP Exactly...neurotypical means you have a similar functioning brain as the majority of the population. And thank you for bringing up neurodivergent as I was diagnosed as a child with ADHD and high functioning autism. So what was that about me being neurotypical?,Damooshiefarmer
2023-06-16 23:14:49+00:00,https://twitter.com/aeronautblue/status/1669846018110701572,just remembered when i was learning french together with english but then we annoyed the teacher SO much (me by being always distracted) she just gave up on it and made us only learn english. she was an amazing teacher but wow. once again. ADHD huh.,aeronautblue
2023-06-16 22:30:54+00:00,https://twitter.com/autogynamelia/status/1669834964097957888,I didn't get diagnosed with ADHD until I was like 41 so before that I internalized the idea that I'm just lazy so deeply that I honestly don't know if it's possible for me to carve it out of my brain.,autogynamelia
2023-06-16 22:08:49+00:00,https://twitter.com/nacholibraa69/status/1669829408482312192,"okay y’all - so i officially got diagnosed with ADHD and took my first adderall today…

and i was prepared for the energy boost i though a stimulant would give you 

but nope. apparently i have the calming, tired, unmotivated, emotionless, dead inside side effect. so that’s fun",nacholibraa69
2023-06-16 21:57:56+00:00,https://twitter.com/hooper_angel15/status/1669826669467631616,"I don’t tell a lot of people this in 2020-2021 I was diagnosed with ADHD.I just thought I catch on to things or process things differently in the classroom because on the court I can remember plays,drills etc. Getting treated was life changing because now I know it’s not just me",hooper_angel15
2023-06-16 21:34:23+00:00,https://twitter.com/oncetheymerge/status/1669820742144495617,"i was also diagnosed with persistant depressive disorder and re-affirmed (meaning i was already diagnosed and they were like ""yup u still got it!"") with GAD w/ panic attack. but they couldnt catch the bipolar or ADHD tho.... https://t.co/u9JSFf2MCE",oncetheymerge
2023-06-16 19:40:06+00:00,https://twitter.com/foxing_around/status/1669791982430953472,"@foxrots Aw gosh thank you!! My DMs should be on, maybe Twitter is being weird? 
But that's so funny to hear! I was diagnosed with ADHD in university after finding a few people talking about it just a little bit too relatable. I'm so glad my comics make you feel good though!",foxing_around
2023-06-16 19:14:49+00:00,https://twitter.com/gigimurakami/status/1669785620389019650,"@jacqueaye I was just diagnosed with ADHD. I suspected something was off but couldn’t put my finger on it, so I just masked tf out of it.",gigimurakami
2023-06-16 17:46:51+00:00,https://twitter.com/Bornfr331/status/1669763481166389248,@69MimiLisa I was diagnosed with ADHD when I was four and this is every second of every day for me. I guess it's hard to remember things when you're not paying attention. 😂 😂,Bornfr331
2023-06-16 17:07:37+00:00,https://twitter.com/Trinitydraco1/status/1669753606994644992,"2/ I was always different. I was an undiagnosed autistic child with diagnosed ADHD and a couple other learning disabilities. Despite this, I was very advanced intellectually and seen as something of a prodigy in music, history, and reading. Obviously I didn’t relate to other kids",Trinitydraco1
2023-06-16 13:37:19+00:00,https://twitter.com/The_Echostar/status/1669700685053534215,"@AmberlynWhite I was just having a crisis over this yesterday, and was doubting if i actually had autism or was just like, gaslighting myself into believing i did? because i got diagnosed with adhd but alot of my friends and other autistic people say its more likely i have autism n yeah! stress",The_Echostar
2023-06-16 13:08:07+00:00,https://twitter.com/MueshyMallow/status/1669693336838631424,@Giga6V I was also diagnosed with ADHD as a young child and found out I was also autistic as an adult last year. It's been a real struggle processing everything and this is 100% what I'm currently going through.,MueshyMallow
2023-06-16 11:44:48+00:00,https://twitter.com/none_of_concern/status/1669672367550005248,"@fizah_alias @toraktech diagnosed with ADHD and ASD, I was glad, I felt liberated especially with meds (started with Ritalin but currently on Concerta now). I also went for DBT/CBT which was great to help me cope with life but there was always something I lacked (which I didn’t realise was that I tried",none_of_concern
2023-06-16 09:46:44+00:00,https://twitter.com/ChrisWalkerEH1/status/1669642656262115335,"@draevans I’m glad nobody diagnosed me (well I was diagnosed ADHD in 1987 but nobody ever told me) 
With no qualifications but for flying marks in a foreign language, there was not a lot going for me in an ex-mining village in rural Ayrshire. I was on holiday alone in France age 16",ChrisWalkerEH1
2023-06-16 09:08:33+00:00,https://twitter.com/HanNeukdae/status/1669633047883313152,"So I found out I was diagnosed with autism at the same time as ADHD...

And I just got diagnosed with clinical depression and anxiety.",HanNeukdae
2023-06-16 08:55:54+00:00,https://twitter.com/jennyocox/status/1669629863215374342,"I was diagnosed with ADHD this year; after 43 years. 43 years of being the odd one out. I thought I knew all about ADHD but understanding it in relation to me as an individual has been quite the learning curve and realising that so much of what I do, how…https://t.co/FvFTxsaoYd",jennyocox
2023-06-16 08:37:32+00:00,https://twitter.com/JosephWemp/status/1669625240329105411,@ThePhoenixPress @HeronOfAlexand1 And cancelled 🤣 but when I was diagnosed with adhd retard was put on my medical file 😅,JosephWemp
2023-06-16 07:39:30+00:00,https://twitter.com/ghostlingsketch/status/1669610637901586435,@finalvamps Autism can be diagnosed later in life and since he is diagnosed for ADHD the symptoms for autism could have been glossed over. I understand that you dislike him but you dont get to decide if hes autistic or not. I was misdiagnosed with ADHD as a child when it was autism.,ghostlingsketch
2023-06-16 03:22:02+00:00,https://twitter.com/strawbrrysage/status/1669545845061046273,basically thought i was diagnosed with autism and she also got me diagnosed with adhd bc of my autism cause i have the inattentive type of adhd she just didnt like my autism symptoms and blamed them on adhd,strawbrrysage
2023-06-16 00:54:02+00:00,https://twitter.com/TKDesignz/status/1669508596999102464,"getting diagnosed with ADHD as an adult is very weird… my whole life i thought this was just how people were and that i was alone in not being able to cope

now i’m finding out that it’s absolutely not normal and i actually have had a disability my whole life",TKDesignz
2023-06-16 00:41:06+00:00,https://twitter.com/M33KOR/status/1669505344849219585,"@NazFX_Studios Something to consider might be a potentially undiagnosed neurodivergence. I was a “gifted kid”, and pushed crazy through uni to get top marks but it lead to massive burn out and me having similar issues for 10+ years until I recently got diagnosed with adhd and started meds",M33KOR
2023-06-16 00:09:01+00:00,https://twitter.com/DarkPrincessVA/status/1669497271312842752,"@viralcosmos But my family were kinda unclear about what I have because my mom is saying I was diagnosed with ADHD and my dad is claiming I wasn't and that it was something else, but I think ADHD seems more likely.",DarkPrincessVA
2023-06-15 22:49:49+00:00,https://twitter.com/darkbast/status/1669477339389132800,"@CobaltAugust I was diagnosed almost 2 years ago with ADHD at age 43. I was diagnosed with autism just over a year ago. I so very much understand.
If you ever want to chat, or rant or vent, my DMs are open. ❤️",darkbast
2023-06-15 22:07:13+00:00,https://twitter.com/CaringCaprinae/status/1669466616348938246,"Like, I'm smart, but I was abused as a child so it took till 28 to be diagnosed with ADHD and given medicine. Now the DEA is blocking that medicine to manufacture an illicit Adderall crisis (and likely a meth crisis).",CaringCaprinae
2023-06-15 21:39:19+00:00,https://twitter.com/whackacole3/status/1669459598120501249,"@SO1AVELLANHELL god same, i’ve been diagnosed and on meds since i was like eight but like the pandemic still hit me like a truck with adhd 😭",whackacole3
2023-06-15 20:54:31+00:00,https://twitter.com/BruceHightower9/status/1669448320186556416,￼ A few months ago I was diagnosed ￼with ADHD ￼ which means Attention-deficit/Hyperactivity disorder.￼ right along with bipolar 2 ￼ disorder.￼,BruceHightower9
2023-06-15 20:34:36+00:00,https://twitter.com/sunstar_sys/status/1669443311810105384,"@LoyalCrowlist I was suspected to be autistic when I was young but only formally diagnosed with ADHD until adulthood

ended up taking myself off my meds as a baby teen too bc they were making me miserable after school when i'd eventually unmask",sunstar_sys
2023-06-15 20:17:56+00:00,https://twitter.com/Ash_the_Jaguar/status/1669439115752886291,@fatbabygoogoo @hiimjustin000 @EverythingOOC It is clear that you don’t know what your talking about. You don’t get groomed into being Autistic. I was 5 when I got diagnosed with ADD and ADHD which immediately placed me on the autism spectrum. ADD and ADHD made me develop more slowly compared to my peers.,Ash_the_Jaguar
2023-06-15 20:15:58+00:00,https://twitter.com/livingd3adgrrl_/status/1669438618958458880,"@99skinz i have major depressive disorder with psychotic features, anxiety, adhd and autism. i also got diagnosed with odd when i was younger but idk if that still really applies",livingd3adgrrl_
2023-06-15 19:53:36+00:00,https://twitter.com/JennaNightmare/status/1669432993750949889,@abdl_breadkun Yeah I was diagnosed with ADHD but not for autism (but I'm willing to bet dollars to donuts I am). Idk it took some research and soul searching for me.,JennaNightmare
2023-06-15 19:48:38+00:00,https://twitter.com/LoyalCrowlist/status/1669431742539911173,honestly being asked multiple times 'are you autistic' is legitimately the reason i was like 'hmm' and went to my doctor about it. turns out yeah! i am! but i was only diagnosed with adhd as a child. shit is wild.,LoyalCrowlist
2023-06-15 19:14:02+00:00,https://twitter.com/_AfterDarkDraws/status/1669423033700823040,"Something I’ve never shared about myself.

I have ADHD! I was diagnosed with it around 2018-2019. Around that time was was also diagnosed with Mild depression and anxiety. I never really shared about my ADHD till this year recently. :) https://t.co/5tP5HoAkSV",_AfterDarkDraws
2023-06-15 18:14:22+00:00,https://twitter.com/glow1squid/status/1669408017178058752,@jaredtbarnes @_RedCrystalRose Im pretty damn close to his age and wasn’t diagnosed with adhd or autism until I was 17. It’s extremely possible for him to not have known until his late teens or even older.,glow1squid
